{
  "schema_version": "confirmed-fact-promotion-review.v1",
  "session_slug": "r8-dai4-teireikai",
  "artifact_type": "confirmed_fact_promotion_review",
  "artifact_origin": "hand_authored_review",
  "review_status": "reviewer_only",
  "source_inventory": "docs/general_questions_minutes/candidate-inventory/r8-dai4-teireikai.candidate-inventory.json",
  "source_utterance_index": "docs/general_questions_minutes/utterance-index/r8-dai4-teireikai.utterances.json",
  "generated_from_commit": "f5cf5852a8b96ba3ceeca96cd728bae99a34c154",
  "summary": {
    "reviewed_candidate_total": 20,
    "promotion_ready_total": 8,
    "context_required_total": 5,
    "hold_total": 4,
    "transcription_review_total": 2,
    "reject_total": 1
  },
  "ready_for_final_review": [
    {
      "candidate_id": "ishigaki-r8-dai4-ippan-shiuezato-atsushi.item03::ishigaki-r8-dai4-teireikai.gq.ishigaki-r8-dai4-ippan-shiuezato-atsushi.u0008::cf01",
      "entry_id": "ishigaki-r8-dai4-ippan-shiuezato-atsushi.item03",
      "council_member": "後上里厚司",
      "theme_group": "公共施設・都市整備",
      "theme": "旧庁舎跡地利用の現状について",
      "item_title": "旧庁舎跡地利用の現状について: 前年度、跡地の維持管理等に対して支出された本市予算 / 跡地利用の優先交渉権者を決定した経緯 / プロポーザル１回目と２回目の基準の違い / 決定された内容の変更はあるか。",
      "original_candidate": "工事は令和7年2月に完了しております",
      "review_category": "A",
      "proposed_confirmed_fact": "旧庁舎跡地活用事業では建物解体や基礎撤去の工事が2025年2月に完了した。",
      "support_excerpt": "本事業の当初スケジュールに合わせ建物解体や基礎具合撤去を実施しており、工事は令和7年2月に完了しております。",
      "source_utterance_id": "ishigaki-r8-dai4-teireikai.gq.ishigaki-r8-dai4-ippan-shiuezato-atsushi.u0008",
      "city_answer_anchor": {
        "utterance_id": "ishigaki-r8-dai4-teireikai.gq.ishigaki-r8-dai4-ippan-shiuezato-atsushi.u0008",
        "source_file": "docs/general_questions_minutes/utterance-index/r8-dai4-teireikai.utterances.json",
        "speaker": "建設部長下地俊一",
        "speaker_role": "executive",
        "line_or_time_hint": "L72-L98"
      },
      "question_anchor": {
        "source_file": "docs/general_questions_minutes/utterance-index/r8-dai4-teireikai.utterances.json",
        "quote_or_excerpt": "3項目目 庁舎跡地活用事業の現況について 1. 前年度、跡地の維持管理等に対して支出された本市予算。 2. 跡地利用の優先交渉権者を決定した経緯。 3. プロポーザル1回目と2回目の基準の違い。 4. 決定された内容の変更はあるか。",
        "speaker": "後上里厚司",
        "line_or_time_hint": "L49-L66"
      },
      "speaker_role": "executive",
      "answer_anchor_source": "direct_item_match",
      "answer_anchor_confidence": "high",
      "confidence": "high",
      "unresolved_note": "",
      "source_resolution_required": false,
      "final_approval_status": "not_approved"
    },
    {
      "candidate_id": "ishigaki-r8-dai4-ippan-shiuezato-atsushi.item07::ishigaki-r8-dai4-teireikai.gq.ishigaki-r8-dai4-ippan-shiuezato-atsushi.u0011::cf01",
      "entry_id": "ishigaki-r8-dai4-ippan-shiuezato-atsushi.item07",
      "council_member": "後上里厚司",
      "theme_group": "スポーツ・青少年交流",
      "theme": "離島甲子園について",
      "item_title": "離島甲子園について",
      "original_candidate": "派遣事業として2014年の第7回大会から中学生選抜チームを結成して派遣してきました",
      "review_category": "A",
      "proposed_confirmed_fact": "石垣市は離島甲子園への派遣事業として、2014年の第7回大会から中学生選抜チームを結成して派遣してきた。",
      "support_excerpt": "本市においても離島甲子園の開催目的に賛同し、派遣事業として2014年の第7回大会から中学生選抜チームを結成して派遣してきました。",
      "source_utterance_id": "ishigaki-r8-dai4-teireikai.gq.ishigaki-r8-dai4-ippan-shiuezato-atsushi.u0011",
      "city_answer_anchor": {
        "utterance_id": "ishigaki-r8-dai4-teireikai.gq.ishigaki-r8-dai4-ippan-shiuezato-atsushi.u0011",
        "source_file": "docs/general_questions_minutes/utterance-index/r8-dai4-teireikai.utterances.json",
        "speaker": "企画部長 菅沼副",
        "speaker_role": "executive",
        "line_or_time_hint": "L134-L152"
      },
      "question_anchor": {
        "source_file": "docs/general_questions_minutes/utterance-index/r8-dai4-teireikai.utterances.json",
        "quote_or_excerpt": "7項目目 離島甲子園について。",
        "speaker": "後上里厚司",
        "line_or_time_hint": "L132-L133"
      },
      "speaker_role": "executive",
      "answer_anchor_source": "direct_item_match",
      "answer_anchor_confidence": "high",
      "confidence": "high",
      "unresolved_note": "",
      "source_resolution_required": false,
      "final_approval_status": "not_approved"
    },
    {
      "candidate_id": "ishigaki-r8-dai4-ippan-takara-munenori.item01::ishigaki-r8-dai4-teireikai.gq.ishigaki-r8-dai4-ippan-takara-munenori.u0010::cf01",
      "entry_id": "ishigaki-r8-dai4-ippan-takara-munenori.item01",
      "council_member": "髙良宗矩",
      "theme_group": "子育て・教育",
      "theme": "日本一安心して子育てできる街・若い方々が帰れる街・住み続けられる街に向けた取組について",
      "item_title": "日本一安心して子育てできる街・若い方々が帰れる街・住み続けられる街に向けた取組について: クーポンを用いた「すくすく応援事業」利用状況及び利用者の声について / 雨天時及び猛暑時にも利用可能な公園や室内遊戯施設整備について / 食物アレルギーを持つ子どもへの支援の現状について / 保育園等入園入所に係るオンライン申請の進捗について / 多胎児家庭への支援の現状及び今後の拡充について / 「部活動等指導環境充実化構築事業」終了後の財源確保について",
      "original_candidate": "お子様1人当たり24,000円のクーポン券を配布しております",
      "review_category": "A",
      "proposed_confirmed_fact": "すくすく応援事業では、1歳の誕生日月まで子ども1人当たり24,000円のクーポン券を配布している。",
      "support_excerpt": "市内のベビー用品を販売する店舗で、おむつやミルク、ベビーフード等の購入に使用できるクーポン券を、1歳の誕生日月まで、お子様1人当たり24,000円のクーポン券を配布しております。",
      "source_utterance_id": "ishigaki-r8-dai4-teireikai.gq.ishigaki-r8-dai4-ippan-takara-munenori.u0010",
      "city_answer_anchor": {
        "utterance_id": "ishigaki-r8-dai4-teireikai.gq.ishigaki-r8-dai4-ippan-takara-munenori.u0010",
        "source_file": "docs/general_questions_minutes/utterance-index/r8-dai4-teireikai.utterances.json",
        "speaker": "市民保健部長 富浜",
        "speaker_role": "executive",
        "line_or_time_hint": "L41-L83"
      },
      "question_anchor": {
        "source_file": "docs/general_questions_minutes/utterance-index/r8-dai4-teireikai.utterances.json",
        "quote_or_excerpt": "1項目目 日本一安心して子育てできる街・若い方々が帰れる街・住み続けられる街に向けた取組について。",
        "speaker": "髙良宗矩",
        "line_or_time_hint": "L1-L40"
      },
      "speaker_role": "executive",
      "answer_anchor_source": "direct_item_match",
      "answer_anchor_confidence": "high",
      "confidence": "high",
      "unresolved_note": "",
      "source_resolution_required": false,
      "final_approval_status": "not_approved"
    },
    {
      "candidate_id": "ishigaki-r8-dai4-ippan-takara-munenori.item01::ishigaki-r8-dai4-teireikai.gq.ishigaki-r8-dai4-ippan-takara-munenori.u0017::cf02",
      "entry_id": "ishigaki-r8-dai4-ippan-takara-munenori.item01",
      "council_member": "髙良宗矩",
      "theme_group": "子育て・教育",
      "theme": "日本一安心して子育てできる街・若い方々が帰れる街・住み続けられる街に向けた取組について",
      "item_title": "日本一安心して子育てできる街・若い方々が帰れる街・住み続けられる街に向けた取組について: クーポンを用いた「すくすく応援事業」利用状況及び利用者の声について / 雨天時及び猛暑時にも利用可能な公園や室内遊戯施設整備について / 食物アレルギーを持つ子どもへの支援の現状について / 保育園等入園入所に係るオンライン申請の進捗について / 多胎児家庭への支援の現状及び今後の拡充について / 「部活動等指導環境充実化構築事業」終了後の財源確保について",
      "original_candidate": "中学生の保護者を対象に月額3250円を補助する負担軽減策を講じました",
      "review_category": "A",
      "proposed_confirmed_fact": "2026年4月に石垣市学校給食弁当代替者補助要項を制定し、中学生の保護者向けに月額3,250円の補助を始めた。",
      "support_excerpt": "令和8年4月に石垣市学校給食弁当代替者補助要項を制定し、中学生の保護者を対象に月額3250円を補助する負担軽減策を講じました。",
      "source_utterance_id": "ishigaki-r8-dai4-teireikai.gq.ishigaki-r8-dai4-ippan-takara-munenori.u0017",
      "city_answer_anchor": {
        "utterance_id": "ishigaki-r8-dai4-teireikai.gq.ishigaki-r8-dai4-ippan-takara-munenori.u0017",
        "source_file": "docs/general_questions_minutes/utterance-index/r8-dai4-teireikai.utterances.json",
        "speaker": "教育部長小永俊",
        "speaker_role": "executive",
        "line_or_time_hint": "L41-L83"
      },
      "question_anchor": {
        "source_file": "docs/general_questions_minutes/utterance-index/r8-dai4-teireikai.utterances.json",
        "quote_or_excerpt": "1項目目 日本一安心して子育てできる街・若い方々が帰れる街・住み続けられる街に向けた取組について。",
        "speaker": "髙良宗矩",
        "line_or_time_hint": "L1-L40"
      },
      "speaker_role": "executive",
      "answer_anchor_source": "direct_item_match",
      "answer_anchor_confidence": "high",
      "confidence": "high",
      "unresolved_note": "",
      "source_resolution_required": false,
      "final_approval_status": "not_approved"
    },
    {
      "candidate_id": "ishigaki-r8-dai4-ippan-miyara-misao.item01::ishigaki-r8-dai4-teireikai.gq.ishigaki-r8-dai4-ippan-miyara-misao.u0004::cf02",
      "entry_id": "ishigaki-r8-dai4-ippan-miyara-misao.item01",
      "council_member": "宮良操",
      "theme_group": "交通・航路",
      "theme": "定期航路事業について",
      "item_title": "定期航路事業について: 第三セクターにおける情報開示について / ふるさと納税石垣市まちづくり支援事業について / 今回の補正予算について / プロポーザル事業発注について / 令和7年度決算について / 出資金とこれまでの経営状況について",
      "original_candidate": "5月28日初就航から定期運行をしています",
      "review_category": "A",
      "proposed_confirmed_fact": "八重山丸は2026年5月28日の初就航以降、定期運行を開始している。",
      "support_excerpt": "まずは本線の就航をアピールするために、台湾初の集客が見込める運行スケジュールで、5月28日初就航から定期運行をしています。",
      "source_utterance_id": "ishigaki-r8-dai4-teireikai.gq.ishigaki-r8-dai4-ippan-miyara-misao.u0004",
      "city_answer_anchor": {
        "utterance_id": "ishigaki-r8-dai4-teireikai.gq.ishigaki-r8-dai4-ippan-miyara-misao.u0004",
        "source_file": "docs/general_questions_minutes/utterance-index/r8-dai4-teireikai.utterances.json",
        "speaker": "企画部長菅沼徹",
        "speaker_role": "executive",
        "line_or_time_hint": "L63-L147"
      },
      "question_anchor": {
        "source_file": "docs/general_questions_minutes/utterance-index/r8-dai4-teireikai.utterances.json",
        "quote_or_excerpt": "1項目目 定期航路事業について。",
        "speaker": "宮良操",
        "line_or_time_hint": "L1-L62"
      },
      "speaker_role": "executive",
      "answer_anchor_source": "direct_item_match",
      "answer_anchor_confidence": "high",
      "confidence": "high",
      "unresolved_note": "",
      "source_resolution_required": false,
      "final_approval_status": "not_approved"
    },
    {
      "candidate_id": "ishigaki-r8-dai4-ippan-tonoshiro-konomi.item02::ishigaki-r8-dai4-teireikai.gq.ishigaki-r8-dai4-ippan-tonoshiro-konomi.u0011::cf01",
      "entry_id": "ishigaki-r8-dai4-ippan-tonoshiro-konomi.item02",